<?xml version="1.0" encoding="UTF-8"?>
<school xmlns:xsi="http://www.w3.org/2001/XMLSchema-instance"
        xsi:noNamespaceSchemaLocation="student_unique.xsd">
    
    <student id="SV01">
        <name>Nguyen Van A</name>
        <dob>2000-05-20</dob>
    </student>
    
    <student id="SV02">
        <name>Tran Thi B</name>
        <dob>2001-11-15</dob>
    </student>
    
    <student id="SV03">
        <name>Le Van C</name>
        <dob>2000-09-01</dob>
    </student>
    
</school>
